{
    "id": "urn:test-instrument",
    "version": "1.1",
    "title": "The InstrumentVersion Title",
    "types": {
        "colors": {
            "base": "enumeration",
            "enumerations": {
                "red": {},
                "blue": {},
                "green": {}
            }
        }
    },
    "record": [
        {
            "id": "q_fake",
            "type": "colors"
        }
    ]
}

