{
  "id": "urn:test-instrument",
  "version": "1.1",
  "title": "The Instrument Title",
  "record": [
    {
      "id": "q_fake",
      "type": "time"
    },
    {
      "id": "q_fake2",
      "type": "time"
    },
    {
      "id": "q_fake3",
      "type": {
        "base": "time",
        "range": {
          "max": "12:34:56"
        }
      }
    }
  ]
}
