{
  "id": "urn:test-instrument",
  "version": "1.1",
  "title": "The Instrument Title",
  "record": [
    {
      "id": "q_fake",
      "type": "date"
    },
    {
      "id": "q_fake2",
      "type": "date"
    },
    {
      "id": "q_fake3",
      "type": {
        "base": "date",
        "range": {
          "max": "2014-01-01"
        }
      }
    }
  ]
}
