{
    "id": "urn:test-instrument",
    "version": "1.1",
    "title": "The InstrumentVersion Title",
    "record": [
        {
            "id": "q_fake",
            "type": {
                "base": "matrix",
                "columns": [
                    {
                        "id": "blah",
                        "type": "text",
                        "required": true,
                        "identifiable": true
                    },
                    {
                        "id": "foobar",
                        "type": {
                            "base": "integer",
                            "range": { "min": 10 }
                        },
                        "identifiable": false
                    }
                ],
                "rows": [
                    {
                        "id": "somerow",
                        "required": true
                    }
                ]
            }
        }
    ]
}

