{
    "id": "urn:test-instrument",
    "version": "1.1",
    "title": "The InstrumentVersion Title",
    "record": [
        {
            "id": "qq_fake",
            "type": "text"
        },
        {
            "id": "qq_foo",
            "type": {
                "base": "matrix",
                "columns": [
                    {
                        "id": "fake",
                        "type": "text",
                        "required": true
                    },
                    {
                        "id": "foobar",
                        "type": {
                            "base": "integer",
                            "range": { "min": 10 }
                        }
                    }
                ],
                "rows": [
                    {
                        "id": "qq",
                        "required": true
                    }
                ]
            }
        }
    ]
}

