{
    "id": "urn:test-instrument",
    "version": "1.1",
    "title": "The InstrumentVersion Title",
    "record": [
        {
            "id": "q_fake",
            "type": {
                "base": "recordList",
                "record": [
                    {
                        "id": "quest1",
                        "type": "text"
                    },
                    {
                        "id": "quest2",
                        "type": {
                            "base": "recordList",
                            "record": [
                                {
                                    "id": "foobar",
                                    "type": "text"
                                }
                            ]
                        }
                    }
                ]
            }
        }
    ]
}

