{
  "id": "urn:test-instrument",
  "version": "1.1",
  "title": "The Instrument Title",
  "record": [
    {
      "id": "q_fake",
      "type": {
        "base": "enumeration",
        "enumerations": {
          "foo": {},
          "bar": {}
        }
      }
    },
    {
      "id": "q_fake2",
      "type": {
        "base": "enumeration",
        "enumerations": {
          "foo": {},
          "bar": {}
        }
      }
    },
    {
      "id": "q_fake3",
      "type": {
        "base": "enumeration",
        "enumerations": {
          "foo": {},
          "bar": {}
        }
      }
    },
    {
      "id": "q_fake4",
      "type": {
        "base": "enumeration",
        "enumerations": {
          "foo": {},
          "bar": {}
        }
      }
    },
    {
      "id": "q_fake5",
      "type": {
        "base": "enumeration",
        "enumerations": {
          "foo": {},
          "bar": {}
        }
      }
    },
    {
      "id": "q_fake6",
      "type": {
        "base": "enumeration",
        "enumerations": {
          "foo": {},
          "bar": {}
        }
      }
    },
    {
      "id": "q_fake7",
      "type": {
        "base": "enumeration",
        "enumerations": {
          "foo": {},
          "bar": {}
        }
      }
    }
  ]
}
