{
    "id": "urn:test-instrument",
    "version": "1.1",
    "title": "The Simple Instrument",
    "record": [
        {
            "id": "q_name",
            "type": "text",
            "required": false,
            "annotation": "optional"
        },
        {
            "id": "q_age",
            "type": "integer",
            "required": false,
            "annotation": "required"
        },
        {
            "id": "q_color",
            "type": "text",
            "explanation": "optional"
        },


        {
            "id": "q_city",
            "type": "text",
            "required": true,
            "explanation": "required"
        },
        {
            "id": "q_country",
            "type": "text",
            "required": true
        },
        {
            "id": "q_car",
            "type": "text",
            "required": true
        },


        {
            "id": "q_place",
            "type": "text",
            "required": true
        },
        {
            "id": "q_something",
            "type": "text",
            "required": true
        },
        {
            "id": "q_anotherthing",
            "type": "text",
            "required": true
        }
    ]
}
