{
    "id": "urn:test-calculation",
    "version": "1.1",
    "title": "The InstrumentVersion Title",
    "record": [
        {
          "id": "age",
          "type": {
            "base": "enumeration",
            "enumerations": {
              "age30-49": {},
              "age50-64": {},
              "age65-and-over": {},
              "age18-29": {}
            }
          }
        }
    ]
}

