{
    "id": "urn:demographics-form",
    "version": "1.0",
    "title": "Demo Demographic Form",
    "record": [
        {
            "id": "first_name",
            "type": "text"
        },
        {
            "id": "last_name",
            "type": "text"
        },
        {
            "id": "gender",
            "type": {
                "base": "enumeration",
                "enumerations": {
                    "male": {},
                    "female": {}
                }
            }
        },
        {
            "id": "age",
            "type": {
                "base": "enumeration",
                "enumerations": {
                    "age18-29": {},
                    "age30-49": {},
                    "age50-64": {},
                    "age65-and-over": {}
                }
            }
        },
        {
            "id": "education",
            "type": {
                "base": "enumeration",
                "enumerations": {
                    "less-than-hs": {},
                    "hs-grad": {},
                    "bachelor-degree": {},
                    "post-graduate-degree": {}
                }
            }
        },
        {
            "id": "ethnicity",
            "type": {
                "base": "enumeration",
                "enumerations": {
                    "white": {},
                    "hispanic": {},
                    "african-american": {},
                    "native-american": {},
                    "asian": {},
                    "other": {}
                }
            }
        },
        {
            "id": "employment",
            "type": {
                "base": "enumeration",
                "enumerations": {
                    "full-time": {},
                    "part-time": {},
                    "unemployed": {},
                    "student": {},
                    "homemaker": {},
                    "retired": {}
                }
            }
        },
        {
            "id": "marital_status",
            "type": {
                "base": "enumeration",
                "enumerations": {
                    "single": {},
                    "married": {},
                    "widowed": {},
                    "divorced": {},
                    "separated": {}
                }
            }
        },
        {
            "id": "children",
            "type": {
                "base": "enumeration",
                "enumerations": {
                    "yes": {},
                    "no": {}
                }
            }
        },
        {
            "id": "number_of_children",
            "type": {
                "base": "enumeration",
                "enumerations": {
                    "one": {},
                    "two": {},
                    "three": {},
                    "four": {},
                    "five-or-more": {}
                }
            }
        }
    ]
}
