{
    "id": "urn:test-instrument",
    "version": "1.1",
    "title": "The InstrumentVersion Title",
    "record": [
        {
            "id": "q_fake",
            "type": "boolean",
            "required": true
        },
        {
            "id": "q_fake2",
            "type": "boolean",
            "required": false
        }
    ]
}

