{
    "id": "urn:test-instrument",
    "version": "1.1",
    "title": "The InstrumentVersion Title",
    "record": [
        {
            "id": "q_fake",
            "type": "text"
        },
        {
            "id": "q_foo",
            "type": {
                "base": "recordList",
                "record": [
                    {
                        "id": "q_fake",
                        "type": "integer"
                    }
                ]
            }
        }
    ]
}

