{
  "id": "urn:matrix",
  "version": "1.0",
  "title": "Matrix Reconciliation",
  "record": [
    {
      "id": "foo",
      "type": {
        "base": "matrix",
        "rows": [
          {
            "id": "row1"
          },
          {
            "id": "row2"
          }
        ],
        "columns": [
          {
            "id": "col1",
            "type": "text"
          },
          {
            "id": "col2",
            "type": "integer"
          }
        ]
      }
    }
  ]
}