{
    "id": "urn:test-instrument",
    "version": "1.1",
    "title": "The InstrumentVersion Title",
    "record": [
        {
            "id": "q_enumeration",
            "type": {
                "base": "enumeration",
                "enumerations": {
                    "foo": {
                        "description": "Foo!"
                    }
                }
            }
        },
        {
            "id": "q_enumerationset",
            "type": {
                "base": "enumerationSet",
                "enumerations": {
                    "foo": {},
                    "bar": null
                }
            }
        }
    ]
}

