{
    "id": "urn:instrument",
    "version": "1.1",
    "title": "The Simple Instrument",
    "record": [
        {
            "id": "q_list",
            "type": {
                "base": "recordList",
                "record": [
                    {
                        "id": "q_thing",
                        "type": "text",
                        "required": true
                    },
                    {
                        "id": "q_like",
                        "type": "text"
                    }
                ]
            }
        }
    ]
}
